{
  "$schema": "../schemas/action-library.schema.json",
  "schema": "robot_llm.actions",
  "schema_version": 4,
  "robot_profile_id": "realman-rm75-dual",
  "actions": [
    {
      "id": "b103f3c6-cae5-4732-b18f-21bba117f9a6",
      "name": "1",
      "type": "MOVE_TO_POINT",
      "parameters": {
        "目标": "机械臂",
        "臂": "左",
        "模式": "move_j",
        "点位": [
          0.14,
          -0.427993,
          0.14819,
          1.552,
          -0.132,
          1.455
        ]
      }
    },
    {
      "id": "54e093c3-2de4-4f86-994d-ec71dbe0cb34",
      "name": "2",
      "type": "MOVE_TO_POINT",
      "parameters": {
        "目标": "机械臂",
        "臂": "右",
        "模式": "move_j",
        "点位": [
          0.198417,
          0.393975,
          -0.14896,
          -3.076,
          0.04,
          -1.005
        ]
      }
    },
    {
      "id": "d3edba7c-494b-4759-9eea-8ec84bcb7061",
      "name": "ready_left",
      "type": "MOVE_TO_POINT",
      "parameters": {
        "目标": "机械臂",
        "臂": "左",
        "模式": "move_j",
        "点位": [
          0.128893,
          -0.471205,
          0.267861,
          1.593,
          -0.442,
          1.513
        ]
      }
    },
    {
      "id": "f30eb001-8755-4413-a1c6-e136c5e15a89",
      "name": "see_left",
      "type": "MOVE_TO_POINT",
      "parameters": {
        "目标": "机械臂",
        "臂": "左",
        "模式": "move_j",
        "点位": [
          0.278086,
          -0.203058,
          0.050196,
          1.803,
          -0.125,
          1.338
        ]
      }
    },
    {
      "id": "262dbfd8-1a3e-45ba-8b78-69f89b79b4b0",
      "name": "ready_right",
      "type": "MOVE_TO_POINT",
      "parameters": {
        "目标": "机械臂",
        "臂": "右",
        "模式": "move_j",
        "点位": [
          0.356222,
          0.278628,
          -0.376883,
          -0.339,
          1.471,
          1.266
        ]
      }
    },
    {
      "id": "300181e5-59ac-4a54-8fe9-b7b5998c9926",
      "name": "ready_2_right",
      "type": "MOVE_TO_POINT",
      "parameters": {
        "目标": "机械臂",
        "臂": "右",
        "模式": "move_l",
        "点位": [
          0.257424,
          0.32087,
          -0.371037,
          0.098,
          1.525,
          1.688
        ]
      }
    },
    {
      "id": "86348185-011b-4ff2-be4f-dcbb1e556e5a",
      "name": "closed_up2mm_right",
      "type": "MOVE_TO_POINT",
      "parameters": {
        "目标": "机械臂",
        "臂": "右",
        "模式": "move_l",
        "点位": [
          0.359126,
          0.320854,
          -0.368281,
          -0.8,
          1.523,
          0.85
        ]
      }
    },
    {
      "id": "fa27e801-cc93-4632-a045-6aafa35d0b98",
      "name": "closed_back_right",
      "type": "MOVE_TO_POINT",
      "parameters": {
        "目标": "机械臂",
        "臂": "右",
        "模式": "move_l",
        "点位": [
          0.359168,
          0.282756,
          -0.368252,
          -0.8,
          1.523,
          0.85
        ]
      }
    },
    {
      "id": "0a9cea03-1a57-47b7-a0be-da133a1ead92",
      "name": "tube_up5mm_right",
      "type": "MOVE_TO_POINT",
      "parameters": {
        "目标": "机械臂",
        "臂": "右",
        "模式": "move_j",
        "点位": [
          0.088563,
          0.377164,
          -0.313391,
          -0.884,
          1.433,
          1.42
        ]
      }
    },
    {
      "id": "a4cfc628-9daf-4f94-b10f-13bedddc04e5",
      "name": "closed_back_2_right",
      "type": "MOVE_TO_POINT",
      "parameters": {
        "目标": "机械臂",
        "臂": "右",
        "模式": "move_j",
        "点位": [
          0.286293,
          0.260982,
          -0.276849,
          0.106,
          1.368,
          2.165
        ]
      }
    },
    {
      "id": "c11fa3c4-5af1-4642-a668-f4595983a04f",
      "name": "ready_pre",
      "type": "MOVE_TO_POINT",
      "parameters": {
        "目标": "机械臂",
        "臂": "右",
        "模式": "move_j",
        "点位": [
          0.224808,
          0.209605,
          -0.312654,
          -0.839,
          1.491,
          1.544
        ]
      }
    },
    {
      "id": "a1ab8197-560d-4835-a6b6-3fdb2eb718c1",
      "name": "place_up_3mm",
      "type": "MOVE_TO_POINT",
      "parameters": {
        "目标": "机械臂",
        "臂": "右",
        "模式": "move_l",
        "点位": [
          0.359633,
          0.319946,
          -0.370515,
          0.516,
          1.48,
          2.098
        ]
      }
    },
    {
      "id": "3f16843f-2f7a-4607-b54e-f01004b41d54",
      "name": "ready_to_place",
      "type": "MOVE_TO_POINT",
      "parameters": {
        "目标": "机械臂",
        "臂": "右",
        "模式": "move_l",
        "点位": [
          0.359657,
          0.279298,
          -0.370502,
          0.516,
          1.48,
          2.097
        ]
      }
    },
    {
      "id": "1d5a7e51-d065-44af-85b3-165f80f2aa3f",
      "name": "left_move_to_tianping",
      "type": "MOVE_TO_POINT",
      "parameters": {
        "目标": "机械臂",
        "臂": "左",
        "模式": "move_j",
        "点位": [
          0.445859,
          -0.291144,
          0.25632,
          1.813,
          -0.022,
          0.085
        ]
      }
    },
    {
      "id": "80fd1277-2423-4382-b912-5173950aab3c",
      "name": "left_camera",
      "type": "MOVE_TO_POINT",
      "parameters": {
        "目标": "机械臂",
        "臂": "左",
        "模式": "move_j",
        "点位": [
          0.252053,
          -0.255205,
          0.18429,
          2.097,
          -1.306,
          0.799
        ]
      }
    },
    {
      "id": "536657c5-bbac-4a9c-a989-78fcf330e039",
      "name": "test_left",
      "type": "MOVE_TO_POINT",
      "parameters": {
        "目标": "机械臂",
        "臂": "左",
        "模式": "move_j",
        "点位": [
          0.128893,
          -0.471205,
          0.267861,
          1.593,
          -0.442,
          1.513
        ]
      }
    },
    {
      "id": "56f5fecf-d6bc-4dd4-b5ab-3ff8941f5bef",
      "name": "3",
      "type": "MOVE_TO_POINT",
      "parameters": {
        "目标": "机械臂",
        "臂": "左",
        "模式": "move_j",
        "点位": [
          0.304329,
          -0.313901,
          0.19083,
          0.08,
          -1.44,
          2.826
        ]
      }
    },
    {
      "id": "0750cec4-8bdd-4a4c-bf5b-8a871cced6c4",
      "name": "move2bottle1",
      "type": "MOVE_TO_POINT",
      "parameters": {
        "目标": "机械臂",
        "臂": "左",
        "模式": "move_j",
        "点位": [
          0.437555,
          -0.208922,
          0.219207,
          2.202,
          -0.01,
          -0.034
        ]
      }
    },
    {
      "id": "66a85026-215f-4a78-9fdc-3719752b10f5",
      "name": "move2bottle3",
      "type": "MOVE_TO_POINT",
      "parameters": {
        "目标": "机械臂",
        "臂": "左",
        "模式": "move_j",
        "点位": [
          0.32092,
          -0.208919,
          0.219806,
          2.2,
          -0.009,
          -0.032
        ]
      }
    },
    {
      "id": "94c273ce-e3cc-4677-9e4c-86426ac967a4",
      "name": "move2bottle2-1",
      "type": "MOVE_TO_POINT",
      "parameters": {
        "目标": "机械臂",
        "臂": "左",
        "模式": "move_j",
        "点位": [
          0.418112,
          -0.208913,
          0.219187,
          2.201,
          -0.009,
          -0.033
        ]
      }
    },
    {
      "id": "6d8b4b65-1730-41e8-9b08-5d9316a86520",
      "name": "move2bottle2-2",
      "type": "MOVE_TO_POINT",
      "parameters": {
        "目标": "机械臂",
        "臂": "左",
        "模式": "move_j",
        "点位": [
          0.396515,
          -0.208921,
          0.219222,
          2.2,
          -0.009,
          -0.033
        ]
      }
    },
    {
      "id": "a0c12534-dae5-4a7e-9833-a81e15995d73",
      "name": "move2bottle2-3",
      "type": "MOVE_TO_POINT",
      "parameters": {
        "目标": "机械臂",
        "臂": "左",
        "模式": "move_j",
        "点位": [
          0.384269,
          -0.208928,
          0.219799,
          2.199,
          -0.008,
          -0.031
        ]
      }
    },
    {
      "id": "74b09abf-78a6-4abd-9d91-c010f59ccceb",
      "name": "move2scale1",
      "type": "MOVE_TO_POINT",
      "parameters": {
        "目标": "机械臂",
        "臂": "左",
        "模式": "move_j",
        "点位": [
          0.292132,
          -0.253422,
          0.099122,
          2.477,
          0.015,
          -0.109
        ]
      }
    },
    {
      "id": "8723ea97-0a62-40eb-a9d9-3a75f7e25f81",
      "name": "move2scale2",
      "type": "MOVE_TO_POINT",
      "parameters": {
        "目标": "机械臂",
        "臂": "左",
        "模式": "move_j",
        "点位": [
          0.382555,
          -0.249403,
          0.078517,
          2.309,
          0.0,
          -0.059
        ]
      }
    },
    {
      "id": "f850372a-85b6-469d-8576-9924fef07062",
      "name": "move2scale3",
      "type": "MOVE_TO_POINT",
      "parameters": {
        "目标": "机械臂",
        "臂": "左",
        "模式": "move_j",
        "点位": [
          0.434043,
          -0.239642,
          0.065005,
          2.162,
          0.059,
          -0.006
        ]
      }
    },
    {
      "id": "5b1f2207-3eee-4cdd-8c12-2b3f5558b2ee",
      "name": "move2scale4",
      "type": "MOVE_TO_POINT",
      "parameters": {
        "目标": "机械臂",
        "臂": "左",
        "模式": "move_j",
        "点位": [
          0.449746,
          -0.246016,
          0.066997,
          2.15,
          -0.002,
          0.026
        ]
      }
    },
    {
      "id": "6888ee5a-fec9-4305-9189-65c4f23f8594",
      "name": "right1",
      "type": "MOVE_TO_POINT",
      "parameters": {
        "目标": "机械臂",
        "臂": "右",
        "模式": "move_j",
        "点位": [
          -0.009451,
          0.335456,
          -0.283662,
          -1.657,
          1.481,
          0.841
        ]
      }
    },
    {
      "id": "30a8fd7d-8e47-4649-abce-dc6f38278b92",
      "name": "left_end",
      "type": "MOVE_TO_POINT",
      "parameters": {
        "目标": "机械臂",
        "臂": "左",
        "模式": "move_j",
        "点位": [
          0.433836,